{
  "order_id": "3eccb6fac6746aecdf8bf04d14c35c366aaa09173b13a2831fb7aae8cbe37a5c",
  "bench": "Mumbai",
  "case_type": "single_complainant",
  "complainant_count": 1,
  "coram": {
    "name": "Dr. Vasant Prabhu",
    "designation": "Secretary"
  },
  "respondents": [
    {
      "name": "Nirmal Developers",
      "role": "promoter"
    }
  ],
  "project": {
    "project_name": "OLYMPIA C D",
    "project_reg_no": "P51800012383",
    "location": "Plot Bearing No / CTS no / Survey Number/Final Plot no. CTS NO 42, Mulund West - 400080",
    "oc_status": {
      "received": false,
      "date": null,
      "issuing_authority": null,
      "note": null
    }
  },
  "primary_order": {
    "order_date": "2020-12-14",
    "complaints": [
      {
        "complaint_no": "CC006000000193162",
        "complainant_names": [
          "Kamlesh Lachhman Tilwani",
          "Lachhman Jiwatram Tilwani"
        ],
        "reliefs": [
          {
            "relief_type": "refund_of_consideration",
            "granted": true,
            "amount": {
              "value": 1454058,
              "type": "refund_principal",
              "recipient": "buyer",
              "interest_rate_description": "9% p. a."
            },
            "deadline": {
              "type": "ongoing_until_event",
              "date": null,
              "days": null,
              "event": "refund of the entire amount",
              "from_date": null,
              "options": null,
              "installments": null
            },
            "validity_window": null,
            "reasoning": "The original order directed the respondent to refund the amount with interest; the respondent failed to comply.",
            "source_page": 8
          },
          {
            "relief_type": "cost",
            "granted": true,
            "amount": {
              "value": 20000,
              "type": "cost",
              "recipient": "buyer",
              "interest_rate_description": null
            },
            "deadline": {
              "type": "ongoing_until_event",
              "date": null,
              "days": null,
              "event": "refund of the entire amount",
              "from_date": null,
              "options": null,
              "installments": null
            },
            "validity_window": null,
            "reasoning": "The original order directed the respondent to pay the cost of the complaint; the respondent failed to comply.",
            "source_page": 8
          }
        ]
      }
    ],
    "order_level_penalty": null,
    "source_page": 8
  },
  "supplementary_proceedings": [
    {
      "proceeding_type": "non_execution_application",
      "date": "2021-08-27",
      "complaint_no": "CC006000000193162",
      "outcome": "allowed",
      "reasoning": "The complainant filed a non-compliance application stating the respondent failed to comply with the order. The respondent appeared and did not object to the issuance of a warrant. MahaRERA directed to issue a recovery warrant.",
      "source_page": 8
    },
    {
      "proceeding_type": "execution_application",
      "date": "2021-10-20",
      "complaint_no": "CC006000000193162",
      "outcome": "allowed",
      "reasoning": "A recovery warrant was issued under Section 40(1) of RERA for the execution of the amount ordered in the primary order, following the non-compliance application.",
      "source_page": 1
    }
  ],
  "extraction_confidence": "high",
  "extraction_notes": "This document is primarily a recovery warrant issued on 20th October 2021, based on an original MahaRERA order dated 14th December 2020 and a non-compliance application dated 27th August 2021. The primary_order details reflect the original 2020 order, while the supplementary_proceedings capture the non-compliance application and the subsequent recovery warrant."
}